{
  "schema_version": "countershape/v1",
  "kind": "WorldInstance",
  "artifact_digest": "sha256:9999999999999999999999999999999999999999999999999999999999999999",
  "world_plan_digest": "sha256:1111111111111111111111111111111111111111111111111111111111111111",
  "candidate_execution_key": "candidate:bbbbbbbbbbbbbbbbbbbbbbbbbbbbbbbbbbbbbbbbbbbbbbbbbbbbbbbbbbbbbbbb",
  "candidate_execution_binding_digest": "sha256:abababababababababababababababababababababababababababababababab",
  "stimulus_digest": "sha256:eeeeeeeeeeeeeeeeeeeeeeeeeeeeeeeeeeeeeeeeeeeeeeeeeeeeeeeeeeeeeeee",
  "attempt_artifact_digest": "sha256:aaaaaaaaaaaaaaaaaaaaaaaaaaaaaaaaaaaaaaaaaaaaaaaaaaaaaaaaaaaaaaaa",
  "attempt_purpose": "CONFIRMATION",
  "instance_nonce": "0123456789abcdef0123456789abcdef",
  "schedule_ordinal": 5
}
